DATE,REASON,ALTTIME,SPECIAL,SPEAKER,INSTITUTION,WEBSITE,TITLE,ABSTRACT
2010/12/06,,,,"Mark Walker","Nebraska",,"What is the algebraic K-theory of a monoid?","This is joint work with Guillermo 
Cortinas, Christian Hassemeyer and Chuck Weibel.  Let $A$ be a commutative 
monoid and $k$ a field.  What part of the algebraic K-theory of the 
monoid-ring $k[A]$ comes from just the monoid and is independent of the 
field $k$?  I describe a partial answer to this question, one which 
involves topological cyclic homology, toric varieties, and Voevodsky's cdh 
topology.  I will also explain how our answer leads to a proof of 
Gubeladze's ``nilpotence'' conjecture for the algebraic K-theory of toric 
varieties in arbitrary characteristic."
2010/12/07,,,,"Kevin Costello","Northwestern",,"Some remarks on elliptic genera",""
2011/02/07,,,,"John Harper","University of Western Ontario",,"On a finiteness theorem and Quillen homology completion for","We prove a finiteness theorem relating finiteness properties
of topological Quillen homology groups and homotopy groups --- this
result should be thought of as an algebras over operads in spectra
analog of Serre's finiteness theorem for the homotopy groups of
spheres. We describe a rigidification of the derived cosimplicial
resolution with respect to topological Quillen homology, and use this
to define Quillen homology completion --- in the sense of
Bousfield-Kan --- for algebras over operads in symmetric spectra. We
prove that under appropriate connectivity conditions, the
coaugmentation into Quillen homology completion is a weak
equivalence --- in particular, such algebras over operads can be
recovered from their topological Quillen homology. Many of the results
described are joint with K. Hess."
2011/02/14,,,,"Michael Ching","University of Georgia",,"A classification of Taylor towers for functors of spaces and spectra","I'll talk about joint work with Greg Arone to describe the data needed
to reconstruct the Taylor tower of a functor from its layers. That
data consists of a bimodule over the derivatives of the relevant
identity functors, together with a coaction of a particular cotriple
on the category of bimodules. I'll describe what we know about this
cotriple for functors of based spaces and/or spectra."
2011/02/28,,,,"Tyler Lawson","University of Minnesota",,"Relative Picard and Brauer groups","Picard and Brauer groupoids, which capture information about
invertible modules and central simple algebras, are objects of
classical interest in algebra and number theory.  The calculation of
these objects is often aided by the use of Galois cohomology.  We will
discuss the generalizations to ring spectra, due to
Hopkins-Mahowald-Sadofsky and Baker-Richter respectively.  We then
discuss how to compute these using Galois cohomology in higher
category theory.  (This talk based on joint work with David Gepner.)"
2011/03/07,,,,"Teena Gerhardt","Michigan State University",,"Cyclotomic spectra and computations in algebraic K-theory","In this talk I will describe joint work with Vigleik Angeltveit, Mike Hill,
and Ayelet Lindenstrauss, yielding new computations of algebraic K-theory
groups. In particular, we consider the K-theory of truncated polynomial
algebras in several variables. Techniques from equivariant stable homotopy
theory are often key to algebraic K-theory computations. In this case we use
n-cubes of cyclotomic spectra to compute the topological cyclic homology,
and hence K-theory, of the rings in question."
2011/03/28,,,,"Justin Thomas","University of Notre Dame",,"Kontsevich's swiss cheese conjecture"," We prove a conjecture of Kontsevich which states that if $A$ is an $E_{d-1}$
 algebra then the Hochschild cohomology object of $A$ is the universal $E_d$
 algebra acting on $A$. The notion of an $E_d$ algebra acting on an $E_{d-1}$
 algebra was defined by Kontsevich using the swiss cheese operad of Voronov.
 We prove a homotopical property of the swiss cheese operad from which the
 conjecture follows."
2011/04/04,,,,"Don Davis","Lehigh University",,"Nonimmersions of real projective spaces and tmf","We use the spectrum tmf to obtain new nonimmersion results
for many real projective spaces $RP^n$ for n as small as 113.
The only new ingredient is some new calculations of tmf-cohomology
groups. We present an expanded table of nonimmersion results.
We also present several questions about tmf."
2011/04/11,,,,"Aravind Asok","University of Southern California",,"Some low-dimensional examples in $A^1$-homotopy theory","We will discuss connectedness in unstable $A^1$-homotopy theory,
focusing on some examples.  We will also discuss the classification of low
dimensional $A^1$-connected smooth proper varieties and its some similarities
to and differences from the corresponding topological classifications."
2011/04/29,,,,"Nick Rozenblyum","MIT",,"Connections on Conformal Blocks","For an algebraic group $G$ and a projective curve $X$, we study the category of $D$-modules on the moduli space $Bun_G$  of principal $G$-bundles on $X$ using ideas from conformal field theory.  We describe this category in terms of the action of infinitesimal Hecke functors on the category of quasi-coherent sheaves on $Bun_G$.  This family of functors, parametrized by the Ran space of $X$, act by averaging a quasi-coherent sheaf over infinitesimal modifications of $G$-bundles at prescribed points of $X$.  We show that sheaves which are, in a certain sense, equivariant with respect to infinitesimal Hecke functors are exactly $D$-modules, i.e. quasi-coherent sheaves with a flat connection.  This gives a description of flat connections on a quasi-coherent sheaf on $Bun_G$ which is local on the Ran space."
2011/05/02,,,,"Gereon Quick","Harvard University",,"Homotopy fixed points of profinite spectra",""
2011/05/03,,,,"Aravind Asok","University of Southern California",,"Some low-dimensional examples in $A^1$-homotopy theory","We will discuss connectedness in unstable $A^1$-homotopy theory,
focusing on some examples.  We will also discuss the classification of low
dimensional $A^1$-connected smooth proper varieties and its some similarities
to and differences from the corresponding topological classifications."
2011/06/06,,,,"Craig Westerland","University of Melbourne",,"Hochschild homology of structured algebras: Vanishing results associated with the Costello construction of TCFT's on Hochschild homology",""
2011/07/05,,,,"Clemens Berger","Université de Nice",,"The Lattice Path Operad and Hochschild Cochains",""
2011/07/12,,,,"Michael Ching","Amherst College",,"Functors from spaces to spectra and the little disc operads","Greg Arone and I have been trying to understand the structure that exists on
the derivatives of a functor in the sense of Goodwillie calculus. Previously
we have shown that these derivatives possess the structure of a coalgebra
over a certain comonad on the category of symmetric sequences. In this talk
I'll try to describe in more depth what this structure amounts to for
functors from based spaces to spectra. Specifically I'll relate these
coalgebras to right modules over the (Koszul duals of) the little disc
operads. This is all joint work with Greg, with substantial input also from
Bill Dwyer."
2011/07/19,,,,"John Harper","University of Western Ontario",,"Quillen homology completion and strong convergence of the","Quillen's derived functor notion of homology provides
interesting and useful invariants in a variety of homotopical
contexts, and includes as special cases (i) singular homology of
spaces, (ii) homology of groups, and (iii) Andre-Quillen homology of
commutative rings. Working in the topological context of symmetric
spectra, we study topological Quillen homology of commutative ring
spectra, $E_n$ ring spectra, and more generally, algebras over any
operad $O$ in spectra. Using a QH-completion construction---analogous to
the Bousfield-Kan R-completion of spaces---we prove under appropriate
conditions (a) strong convergence of the associated homotopy spectral
sequence, and (b) that connected O-algebras are QH-complete---thus
recovering the O-algebra from its topological Quillen homology plus
extra structure. A key problem in usefully describing this extra
structure was solved recently using homotopical ideas in joint work
with Kathryn Hess that describes a rigidification of the derived
comonad that coacts on the object underlying topological Quillen
homology, and plays the analogous role (in symmetric spectra) of the
Koszul cooperad associated to a Koszul operad in chain complexes. This
talk is an introduction to these results with an emphasis on proving
(a) and (b) which is joint work with Michael Ching."
2011/08/02,,,,"Gabriel Katz","MIT",,"Morse Theory,  gradient flows, concavity, and complexity on manifolds with boundary","Let $f: X \rightarrow \mathbb{R}$ be a Morse function on a manifold $X$ and $v$ its gradient-like vector field. Classically, the topology of a closed $X$ can be described in terms of the spaces of v-trajectories that link the singular points of $f$. On manifolds with boundary, the situation is somewhat different: there, a massive set of nonsingular functions is available. For such Morse data $(f, v)$, the interactions of the gradient flow with the boundary dX take central stage. We will introduce and measure the convexity and concavity of a $v$-flow relative to $dX$. ``Some manifolds are intrinsically more concave than others with respect to any gradient flow'' is the main slogan of the talk. Stated differently, the intrinsic concavity of $X$ is a reflection of its complexity. We will explain how this approach leads to new topological invariants, both of the flow $v$ and of the manifold $X$. In 3D, we have a good grasp of these invariants and their connection to the classification of 3-folds."
2011/08/09,,,,"Matthew Gelvin","University of Copenhagen",,"What is a $p$-local finite group?","Fusion systems are an algebraic description of the $p$-local structure of a finite group.  A centric linking system is the algebraic data needed to construct a topological classifying space for a fusion system; recent work of Andy Chermak shows that in fact, every saturated fusion system has a unique associated centric linking system.  The collection of these data is what is known as a $p$-local finite group.

In this talk, I will try to give some insight about the structure of $p$-local finite groups.  I will also give a brief discussion of the more topological notion of retractive transfer triple, which appears to be equivalent to the data of a $p$-local finite group."
2011/09/12,,,,"Vesna Stojanoska","MIT",,"Duality for Topological Modular Forms","It has been observed that certain localizations of the spectrum of topological modular forms tmf are self-dual (Mahowald-Rezk, Gross-Hopkins). We provide an integral explanation of these results that is internal to the geometry of the (compactified) moduli stack of elliptic curves $\mathcal{M}_{\text{ell}}$ yet is only true in the derived setting. When $p$ is inverted, choice of level-$p$-structure for an elliptic curve provides a geometrically well-behaved cover of $\mathcal{M}_{\text{ell}}$, which allows one to consider tmf as the homotopy fixed points of tmf($p$), topological modular forms with level-$p$-structure, under a natural action by $\text{GL}_{2}(\mathbb{Z}/p)$. Specializing to $p=2$ or $p=3$ we obtain that as a result of Grothendieck-Serre duality, tmf($p$) is self dual. The vanishing of the associated Tate spectra then makes tmf itself  Anderson self-dual."
2011/09/26,,,,"Oscar Randal-Williams","University of Copenhagen",,"Stable Moduli Spaces of High-Dimensional Manifolds","Madsen and Weiss' theorem --- identifying the stable homology of moduli spaces of Riemann surfaces --- and the theorem of Barratt-Priddy, Quillen, and Segal --- identifying the stable homology of classifying spaces of symmetric groups --- fit into a natural hierarchy of statements concerning the homology of moduli spaces of $(n-1)$-connected $2n$-manifolds. I will discuss recent joint work with Søren Galatius which as a special case proves these statements for all $n = 3, 4, \ldots$"
2011/10/03,,,,"Chris Schommer-Pries","MIT",,"On the Uniqueness of the Homotopy Theory of Higher Categories","In this talk we report on joint work with Clark Barwick. We give a short list of axioms that a quasicategory should satisfy to be considered a reasonable homotopy theory of $(\infty,n)$-categories. We show that the space of such quasicategories is homotopy equivalent to $\mathrm{B}(\mathbb{Z}/2)^{n}$,  generalizing a theorem of Toën when $n=1$, and verifying two conjectures of Simpson. In particular, any two such quasicategories are equivalent. We also provide a large class of examples satisfying our axioms, including those of Joyal, Kan, Lurie, Simpson, and Rezk."
2011/10/17,,,,"Thomas Kragh","MIT",,"","In this talk I will start by describing what Hamiltonian Floer homology is and how it relates to 1-periodic orbits of a Hamiltonian flow. Then I will consider the case $\mathbb{R}^{2n}$ and describe how finite dimensional approximations lead to considering periodic cobordism theories (complex and real) as ``coefficient rings''. I will then in the more general case of a Liouville domain sketch how to define a spectrum-module over these coefficient rings with a set of generators in 1-1 correspondence with periodic orbits."
2011/10/24,,,,"Nathaniel Stapleton","MIT",,"Towards Transchromatic Twisted Character Maps","In the 80's Hopkins, Kuhn, and Ravenel developed a way to study cohomology rings of the form $E^{*}(\mathrm{B}G)$ in terms of a character map. Their map can be interpreted as a map of cohomology theories beginning with a height $n$ cohomology theory $E$ and landing in a height 0 cohomology theory with a rational algebra of coefficients that they construct out of $E$. In this talk we will use the language of $p$-divisible groups to discuss various ways of generalizing their map to every height between 0 and $n$."
2011/10/31,,,,"Kyle Ormsby","MIT",,"Tate Normal Form in Level Resolutions of the $K(2)$-Local Sphere","The $K(2)$-localization of the sphere spectrum admits a conjectural small resolution built from TMF and ``TMF with level structures'' --- the evaluation of the TMF sheaf on the stack of elliptic curves equipped with an order $l$ subgroup.  In this talk, I will use variations on Tate normal form to describe several Hopf algebroids that stackify to elliptic curves with level structure.  These Hopf algebroids lead to computations of the Behrens-Lawson spectrum $Q(l)$.  This is current work with Mark Behrens, Nat Stapleton, and Vesna Stojanoska."
2011/11/07,,,,"Kirsten Wickelgren","Harvard",,"Massey Products in Galois Cohomology via Rational Points","The Milnor conjecture identifies the cohomology ring $H^{*}(\text{Gal}(\bar{k}/k), \mathbb{Z}/2)$ with the tensor algebra of $k^{*}$ mod the ideal generated by $x \otimes 1-x$ for $x$ in $k - \{0,1\}$ mod 2. In particular, $x \cup 1-x$ vanishes, where $x$ in $k^{*}$ is identified with an element of $H^{1}$. We show that order $n$ Massey products of $n-1$ factors of $x$ and one factor of $1-x$ vanish by embedding $\mathbb{P}^{1} - \{0,1,\infty\}$ into its Picard variety and constructing $\text{Gal}(\bar{k}/k)$-equivariant maps from $\pi_{1}^{\text{et}}$ applied to this embedding to unipotent matrix groups. This also identifies Massey products of the form $\langle 1-x, x, \ldots , x , 1-x\rangle$ with $f \cup 1-x$, where $f$ is a certain cohomology class which arises in the description of the action of $\text{Gal}(\bar{k}/k)$ on $\pi_{1}^{\text{et}}(\mathbb{P}^1 - \{0,1,\infty\})$."
2011/11/14,,,,"Ricardo Andrade","Stanford University",,"Filtered spaces and homology of $E_n$-algebras","The topological chiral homology of $E_n$-algebras can be calculated using certain categories of configurations on manifolds. These are obtainable from a construction associating to each filtered space a category whose morphisms are paths which respect the filtration. In this context, Dwyer-Kan localizations arise from forgetting stages of the filtration. Such a result recovers elementary properties of chiral homology."
2011/11/21,,,,"Gonçalo Tabuada","MIT",,"The Fundamental Theorem via Derived Morita Invariance, Localization, and $\mathbb{A}^{1}$-Homotopy Invariance","We prove that every functor defined on dg categories which is derived Morita invariant, localizing, and $\mathbb{A}^{1}$-homotopy invariant, satisfies the fundamental theorem. As an application, we recover, in a unified and conceptual way, Weibel and Kassel's fundamental theorems in homotopy algebraic K-theory, and periodic cyclic homology, respectively."
2011/11/28,,,,"John Francis","Northwestern University",,"Factorization Homology","Factorization homology, or the topological chiral homology of Lurie, is a homology theory for manifolds conceived as a topological analogue of the chiral homology of Beilinson and Drinfeld. I'll describe an axiomatic characterization of factorization homology, generalizing the Eilenberg-Steenrod axioms for usual homology. The use of excision for factorization homology facilitates a short proof of the nonabelian Poincare duality of Salvatore and Lurie; this proof generalizes to give a nonabelian Poincare duality for stratified manifolds, joint work with David Ayala and Hiro Tanaka. Work in progress with Kevin Costello aims to express quantum invariants of knots and 3-manifolds in factorization terms, which, time permitting, I'll outline."
2011/12/05,,,,"Andrew Blumberg","the University of Texas",,"Progress towards TC(MU)","The algebraic K-theory of the complex cobordism spectrum is an object of basic interest, both because it provides an interesting example of K-theory of a non-classical ring and because it should shed light on K(S). There is reason to believe that K(MU) should be approachable via trace methods, which focuses attention on understanding THH(MU) and TC(MU). This talk describes work in progress to describe the equivariant homotopy type of THH of a Thom spectrum as an equivariant Thom spectrum.  The ingredients for this description include the Hill-Hopkins-Ravenel norm and a modernized view of equivariant infinite loop space theory.  This is joint work with Angeltveit, Gerhardt, and Hill."
2011/12/12,,,,"Emily Riehl","Harvard",,"Algebraic Model Structures and Cellularity","Algebraic model categories are a variant of Quillen's classical notion in which the (co)fibrations are equipped with extra structure witnessing their defining lifting properties. Many ordinary model categories admit this extra structure, giving rise to a plethora of examples. In this talk we present several theorems illustrating various features of this theory. In particular, we focus on a series of results that guarantee the existence of algebraic Quillen adjunctions and algebraic monoidal model structures just when particular cofibrations are cellular: eg, relative cell complexes, not mere retracts of such. On account of these results, the algebraic theory places great emphasis on a distinction that is also present in expository accounts of the classical theory, where its role is less transparent."
2012/02/13,,,,"Roman Mikhailov","Steklov; IAS",,"A combinatorial description of homotopy groups of spheres","The talk is based on recent results obtained jointly with Jie Wu. For all $n>k$, we construct a finitely generated group by explicit generators and relations such that its center is the $n$-th homotopy group of the $k$-th sphere."
2012/02/21,,,,"Stefan Schwede","Bonn",,"Equivariant properties of symmetric products","The filtration on the infinite symmetric product of spheres by number of factors provides a sequence of spectra between the sphere spectrum and the integral Eilenberg-Mac Lane spectrum. This filtration has received a lot of attention and the subquotients are interesting stable homotopy types.
In this talk I will discuss the equivariant stable homotopy types, for finite groups, obtained from this filtration for the infinite symmetric product of representation spheres. The filtration is more complicated than in the non-equivariant case, and already on the zeroth homotopy groups an interesting filtration of the augmentation ideal of the Burnside ring functor arises. Our method is by `global' homotopy theory, i.e., we study the simultaneous behaviour for all finite groups at once. The equivariant subquotients are no longer rationally trivial, nor even concentrated in dimension 0."
2012/02/27,,,,"Dominic Verity","CoACT",,"Homotopy Coherent Adjunctions","The aim of this talk is to discuss the homotopy coherence properties of
adjunctions between quasi-categories.

Taking as our lead the theory of the ``walking adjunction'' A of 2-category
theory, we generalise to categories enriched in quasicategories and show that
this same 2-category plays a similar role in this new context. Specifically,
using insights drawn from the calculus of string diagrams we give an explicit
presentation of A as a simplicially enriched category. We then use this to show
that if C is any quasicategory enriched category and u is a right adjont 0-arrow
in C, in some suitable sense to be discussed, then this data may be completed to
give a simplicially enriched functor A->C. Furthermore, we show that the space
of all such exensions is contractible.

That adjunctions of quasicategories may be completed up to enriched functors on
A in this way contains, in its very essence, the adjunction data discussed by
Jacob Lurie. Such enriched functors encapsulate both the coherent monad and the
coherent comonad generated by such an adjunction and provide the building blocks
upon which to found a formal theory of such things along the lines established
by Street in the 2-categorical context."
2012/03/05,,,,"David Gepner","Regensburg; MIT",,"The $A^1$- localization of noncommutative motives and homotopy K-theory","The motivic perspective on algebraic K-theory is a useful
means of constructing trace maps as well as other additive or
localizing invariants which are often easier to compute. For instance,
a homotopy invariant form of K-theory is obtained by forming the
$A^1$-localization of noncommutative motives before passing to homotopy groups. In order to relate this to the usual notion of homotopy K-theory it is useful to have a direct construction of this
localization, and this involves understanding the additive group $A^1$
in the noncommutative context. This is joint work with Andrew Blumberg and Goncalo Tabuada."
2012/03/12,,,,"Igor Kriz","University of Michigan",,"Khovanov homology and k-theory","I plan to discuss my recent joint work
with Po Hu and Daniel Kriz on a lifting of Khovanov homology
to connective k-theory. I will also talk about its relation to recent
work by Lipshitz and Sarkar. As a technical tool, our approach exhibits
a curious link between modular functors and the Elmendorf-Mandell
approach to multiplicative infinite loop space theory."
2012/03/13,,,,"Po Hu","Wayne State University",,"Topological hermitian cobordism","I will discuss topological Hermitian cobordism, an RO(G)-graded
Z/2 x Z/2- spectrum constructed in a joint paper with Igor Kriz.
I will also talk about the method for calculating its RO(G)-graded
coefficients completely."
2012/03/19,,,,"Inna Zakharevich","MIT",,"Scissors congruence and K-theory","Hilbert's third problem asks the following question: given two
polyhedra with the same volume, is it possible to dissect one into
finitely many polyhedra and rearrange it into the other one?  The
answer (due to Dehn in 1901) is no: there is another invariant that
must also be the same.  Further work in the 60s and 70s generalized
this to other geometries by constructing groups which encode scissors
congruence data.  Though most of the computational techniques used
with these groups related to group homology, the algebraic K-theory of
various fields appears in some very unexpected places in the
computations.  We will give a different perspective on this problem by
examining it from the perspective of algebraic K-theory: we construct
the K-theory spectrum of a scissors congruence
problem and relate some of the classical structures on scissors
congruence groups to structures on this spectrum."
2012/04/02,,,,"David Ayala","Harvard",,"Higher categories are sheaves on manifolds","Many proposed higher categories come from geometric situations.  This
talk will demonstrate a constructive connection between a homotopy
theory of local invariants of n-manifolds and that of weak n-categories
in the sense of Rezk.  Connections to specific topological field theories will be discussed.  This is a report on joint work with Nick Rozenblyum."
2012/04/09,,,,"Burt Totaro","Cambridge",,"New bounds for the cohomology and Chow ring of finite groups","Symonds (2010) showed that the cohomology ring
of a finite group $G$ with a faithful complex representation of dimension $n$
is generated by elements of degree at most $n^2$.
This was a remarkable advance, since no bound was known before.
Symonds's proof combined equivariant cohomology with commutative
algebra (Castelnuovo-Mumford regularity). We give better bounds
for the cohomology ring of a p-group. The methods also apply
to the Chow ring of algebraic cycles on $BG$."
