DATE,REASON,ALTTIME,SPECIAL,SPEAKER,INSTITUTION,WEBSITE,TITLE,ABSTRACT

2015/12/07,,,,"Bhargav Bhatt","University of Michigan","http://www-personal.umich.edu/~bhattb/","Perfect rings and applications","I will describe certain surprising features of algebraic geometry that arise if one works exclusively with perfect rings of positive characteristic $p$; these features are are strongly reminiscent of derived algebraic geometry. When combined with some higher algebraic $K$-theory, this will allow us to attach ``determinants'' to certain mildly non-linear objects. Time permitting, I will explain why these determinants are useful in constructing an object of interest in arithmetic geometry: an algebraic variety in characteristic $p$ that parametrizes $\Z_p$-lattices in a finite dimensional $\Q_p$-vector space. This is joint work with Peter Scholze."
2015/11/16,,,,"David Treumann","Boston College","https://www2.bc.edu/david-treumann/materials.html","The Maslov cycle and the J-homomorphism"," Let $L$ be an exact Lagrangian submanifold of a cotangent bundle $T^*M$. If a topological obstruction vanishes, a Floer-theoretic construction of Nadler and Zaslow gives a functor from the category of local systems of $R$-modules on $L$ to the category of constructible sheaves of $R$-modules on $M$. I will discuss a variation of this construction that allows $R$ to be a ring spectrum. I hope it won't take any knowledge of symplectic geometry to follow the talk. This is joint work with Xin Jin."
2015/11/23,,,,"Ian Hambleton","McMaster University; Fields Institute","http://ms.mcmaster.ca/ian/ian.html","Group actions on spheres with rank one isotropy"," Actions of finite groups on spheres can be studied in various different geometrical settings, such as (A) smooth $G$-actions on a (closed manifold) homotopy sphere, (B) finite $G$-homotopy representations (as defined by tom Dieck), and (C) finite $G$-CW complexes homotopy equivalent to a sphere. These three settings generalize the basic models arising from unit spheres $S(V)$ in orthogonal or unitary $G$-representations. In the talk, I will discuss the group theoretic constraints imposed by assuming that the actions have rank 1 isotropy (meaning that the isotropy subgroups of $G$ do not contain $\Z/p \times \Z/p$, for any prime $p$).  Motivation for this requirement arises from the work of Adem and Smith (2001) on the existence of free action on products of spheres.

The main results are as follows: we give a complete answer in setting (C), where we prove that a necessary and sufficient group theoretic condition is that certain extensions, called $QD(p)$, of $SL(2,p)$ by $\Z/p \times \Z/p$ are not involved in $G$. In setting (B) we encounter more group theoretic restrictions, and give a complete answer for the finite simple groups $G$ of rank 2. The arguments use chain complexes over the orbit category. This is joint work with Ergun Yalcin."
2015/11/09,,,,"Eric Peterson","Harvard","http://www.math.harvard.edu/~ecp/","Determinantal K-theory and a few applications","Chromatic homotopy theory is a divide-and-conquer program for algebraic topology, where we study an approximating sequence of what we'd first assumed to be ``easier'' categories. These categories turn out to be very strangely behaved -- and further appear to be equipped with intriguing and exciting connections to number theory. To give an appreciation for the subject, I'll describe the most basic of these strange behaviors, then I'll describe an ongoing project which addresses a small part of the ``chromatic splitting conjecture''."
2015/11/02,,,,"Kirsten Wickelgren","Georgia Tech","http://people.math.gatech.edu/~kwickelgren3/","The $\A^1$-Milnor number: counting zeros arithmetically","A celebrated result of Eisenbud--Kimshaishvili--Levine computes the local degree of a smooth function $f : \R^n \to \R^n$ with an isolated zero at the origin. Given a polynomial function with an isolated zero at the origin, we prove that the local  $\A^1$-Brouwer degree equals the degree quadratic form of Eisenbud--Khimshiashvili--Levine, answering a question posed by David Eisenbud in 1978. This talk will present this result and then discuss applications to the study of singularities if time permits. This is joint work with Jesse Kass."
2015/10/26,,,,"Marc Hoyois","MIT","http://math.mit.edu/~hoyois/","Secondary K-theory and the categorified Chern character","The secondary $K$-theory of a derived stack $X$ is the $K$-theory of 2-vector bundles on $X$, also known as smooth proper $k$-linear dg-categories when $X = \mathrm{Spec}(k)$. It receives nontrivial maps from several interesting invariants: the Brauer spectrum of $X$, the iterated $K$-theory $K(K(X))$, and the Grothendieck ring of varieties (if $X$ is a field of characteristic zero). Toën and Vezzosi have constructed a character map associating to every 2-vector bundle a torus-invariant function on the double free loop space of $X$. I will explain how to refine their construction to obtain a secondary Chern character on secondary $K$-theory. This involves a localization theorem for traces in symmetric monoidal $(\infty,2)$-categories and a categorified version of the ordinary Chern character, which is a functor from noncommutative mixed motives over $X$ (in the sense of Kontsevich) to $S^1$-equivariant perfect complexes on $LX$. This is joint work with Sarah Scherotzke and Nicol\`o Sibilla."
2015/10/19,,,,"John Terilla","CUNY","http://qcpages.qc.cuny.edu/~jterilla/","Homotopy probability theory with an application to fluids","Homotopy probability theory is a version of probability theory in which the vector space of random variables is replaced with a chain complex.  I'll discuss how to use homotopy algebra (rather than analysis) to extract meaningful expectations and correlations among random variables.  I'll give some natural examples, including an example that extends ordinary probability theory on a finite volume Riemannian manifold and has applications to fluid flow."
2015/10/05,,,,"Cary Malkiewich","UIUC","http://math.uiuc.edu/~cmalkiew/","Duality in topological Hochschild homology (THH)","Topological Hochschild homology ($THH$) is a beautiful and computable invariant of rings and ring spectra. In this talk, I will focus on the ring spectrum $DX$, and discuss a few different aspects of $THH(DX)$. For example, it splits when $X$ is a suspension, and we can use this for computations in topological cyclic homology. I will also recall the ``Atiyah duality'' between $THH(DX)$ and the free loop space $LX$, and prove that this duality preserves the genuine $S^1$-structure. This uses the new ``norm'' model of $THH$, and a surprising technical result about orthogonal $G$-spectra. If there is time, I will apply these tools once more and describe an enrichment of the character map from representation theory."
2015/09/28,,,,"Sune Reeh","MIT","http://math.mit.edu/~reeh/Sune_Precht_Reeh.html","Saturated fusion systems as stable retracts of groups","A saturated fusion system associated to a finite group $G$ encodes the $p$-structure of the group as the Sylow $p$-subgroup enriched with additional conjugation. The fusion system contains just the right amount of algebraic information to for instance reconstruct the $p$-completion of $BG$, but not $BG$ itself. Abstract saturated fusion systems $F$ without ambient groups exist, and these have ($p$-completed) classifying spaces $BF$ as well. In spectra, the suspension spectrum of $BF$ becomes a retract of the suspension spectrum of $BS$, for the Sylow $p$-subgroup $S$, so $BF$ gets encoded as a characteristic idempotent in the double Burnside ring of $S$. This way of looking as fusion systems as stable retracts of their Sylow $p$-subgroups is a very useful tool for generalizing theorems from groups or $p$-groups to saturated fusion systems.  In joint work with Tomer Schlank and Nat Stapleton, we use this retract approach to do Hopkins-Kuhn-Ravenel character theory for all saturated fusion systems by building on the theorems for finite $p$-groups."
2015/09/21,,,,"Rob Thompson","CUNY","http://math.hunter.cuny.edu/thompson/","An unstable change of rings for Morava $E$-theory","The Bousfield-Kan (or unstable Adams) spectral sequence can be constructed for various homology theories such as Brown-Peterson homology $BP$, Johnson-Wilson theory $E(n)$ or Morava $E$-theory $E_n$. For nice spaces the $E_2$-term is given by $\mathrm{Ext}$ in a category of unstable comodules. We establish an unstable Morava change of rings isomorphism between $\mathrm{Ext}_{\mathcal{U}_{BP_*BP}}(BP_*,M)$ and $\mathrm{Ext}_{\mathcal{U}_{{E_n}_*E_n}}({E_n}_*,{E_n}_*\otimes_{BP_*}M)$ for unstable $BP_*BP$-comodules that are $v_n$-local and satisfy $I_nM=0$. We show that the latter can be interpreted as Ext in the category of comodules over a certain bialgebra. This has implications for the convergence of the Bousfield-Kan spectral sequence."
2015/09/14,,,,"Martin Gallauer Alves de Souza","UCLA","http://user.math.uzh.ch/gallauer/","Traces and homotopy colimits","J.P. May proved that traces in stable monoidal homotopy categories are additive in cofiber sequences. It is then natural to ask about the interaction of traces and homotopy colimits in general. In this talk we will give an answer for homotopy colimits indexed over EI-categories. The proof involves generalizing the notion of trace from the realm of categories to derivators. It will be sketched if time permits."
2010/02/08,,,,"Simona Paoli","Penn State Altoona",,"Homotopical properties of a weakly globular model of homotopy types","Homotopy $n$-types are an important class of topological spaces: they amount to CW complexes whose homotopy groups vanish in dimension higher than $n$. The problem of modeling homotopy types is relevant both in higher category theory and homotopy theory and received contributions from both areas. There is a particularly simple model of homotopy types in the path connected case, consisting of n-fold categories internal to groups, also called $cat^n$-groups. This model, however, has the disadvantage that is it does not have an algebraic description of the Postnikov decomposition nor it is easy to establish algebraically when a map of $cat^n$-groups is a weak equivalence.  

In this talk we introduce a new model of connected $n$-types through a subcategory of $cat^n$-groups, which we call weakly globular, for which the above issues are resolved in transparent way. We also describe other homotopical properties of this model, and discuss the relevance of these structures for higher category theory. "
2010/03/01,,,,"Mark Behrens","MIT",,"The homotopy groups of the $E(2)$-local sphere, revisited","Shimomura and Yabe computed the homotopy groups of the $E(2)$-local sphere at primes greater than or equal to $5$.  However, their computation is difficult to understand.  I will describe a conceptual way to understand the answer, and the computation.  The goal is to make the answer as concrete as the image of the $J$ homomorphism.  We'll see of this goal is achieved..."
2010/03/08,,,,"Andrew Salch","Johns Hopkins University",,"$v_2$ and $v_4$","We discuss some new methods for computing the cohomology of Morava stabilizer groups at large heights. We apply these methods to compute a good approximation to the cohomology of the 5-primary height 4 stabilizer group, giving us some interesting information about $v_4$-periodic stable homotopy groups of spheres, and we discuss what is involved in computing the entire cohomology of the Morava stabilizer group for heights 4 and up."
2010/03/15,,,,"Rob Thompson","CUNY",,"$v_n$-periodic $\Pi$ algebras","A $\Pi$-algebra is a sequence of groups, along with an action of the primary homotopy operations, which are indexed by homotopy groups of wedges of spheres.  It is natural to view the homotopy groups of a space as an object in the category of $\Pi$-algebras.  The $v_n$-periodic homotopy groups of a space are obtained by inverting non-nilpotent self maps of finite complexes.  In this talk I will investigate $v_n$-periodic $\Pi$-algebras."
2010/03/29,,,,"Gonçalo Tabuada","Universidade Nova de Lisboa",,"Non-commutative motives","In this talk I will describe the construction of the category of non-commutative motives $[1,2,3]$ in Drinfeld-Kontsevich's non-commutative algebraic geometry program. In the process, I will present the first conceptual characterization of Quillen's higher K-theory since Quillen's foundational work in the 70's. As an application, I will show how these results allow us to obtain for free the higher Chern character from K-theory to cyclic homology.

References:

[1] D.-C. Cisinski and G. Tabuada, Symmetric monoidal structure on
Non-commutative motives. Available at arXiv:1001.0228.

[2] D.-C. Cisinski and G. Tabuada, Non-connective K-theory via universal
invariants. Available at arXiv:0903.3717.

[3] G. Tabuada, Higher K-theory via universal invariants. Duke Math.
Journal, 145 (2008), no.1, 121-206.
2010/03/30,,,,"Matthew Gelvin","MIT",,"Fusion Action Systems","Fusion systems, an abstraction of the $p$-local structure of finite groups, lie in the intersection of algebraic topology and finite group theory.  In this talk I detail a ``theory of fusion systems with many objects,'' generalizing fusion system theory to imitate actions of a finite group on a finite set. This generalization will come in three stages:  as a simple condition to be put on a finite $p$-group-set, as algebraic structure added to the fusion system, and finally as an additional layer of structure necessary to construct classifying spaces and do homotopy theory."
2010/04/05,,,,"Fabien Morel","Ludwig-Maximilians-Universität",,"An $A^1$-homological criterium for the rigidity property","This is one of the main technical step in the proof of the Friedlander-Milnor conjecture, and uses a lot of ``classical'' topological arguments (lower central series, $A^1$-derived functors of the free Lie algebra functors, devissage of the Lie algebra functor in terms of other polynomial functors."
2010/04/13,,,,"Angélica Osorno","MIT",,"An Infinite Loop Space Structure for $K$-theory of Bimonoidal Categories","In recent work of Baas-Dundas-Richter-Rognes, the authors introduce the notion of the $K$-theory of a bimonoidal category $R$, and show that it is equivalent to the algebraic $K$-theory space of the ring spectrum $HR$. In this thesis we show that $K(R)$ is the group completion of the classifying space of the 2-category $Mod_R$ of modules over $R$, and show that $Mod_R$ is a symmetric monoidal 2-category. We explain how to use this symmetric monoidal structure to produce a $\Gamma$-(2-category), which gives an infinite loop space structure on $K(R)$. We show that the equivalence mentioned above is an equivalence of infinite loop spaces."
2010/04/26,,,,"Martin Frankland","MIT",,"Quillen cohomology of $\Pi$-algebras and application to their realization","A $\Pi$-algebra is a graded group with additional structure that makes it look like the homotopy groups of a space. Given one such object $A$, one may ask if it can be realized topologically: Is there a space $X$ such that $\pi_*X$ is isomorphic to $A$ as a $\Pi$-algebra, and if so, can we classify them?

Work of Blanc-Dwyer-Goerss provided an obstruction theory to realizing a $\Pi$-algebra $A$, where the obstructions (to existence and uniqueness) live in certain Quillen cohomology groups of $A$. What do these groups look like, and can we compute them?

We will tackle this question from the algebraic side, focusing on Quillen cohomology of truncated $\Pi$-algebras. We will then use the obstruction theory to obtain results on the classification of certain 2-stage homotopy types, and compare them to what is known from other approaches."
2010/04/27,,,,"Martin Frankland","MIT",,"Quillen cohomology of $\Pi$-algebras and application to their realization","A $\Pi$-algebra is a graded group with additional structure that makes it look like the homotopy groups of a space. Given one such object $A$, one may ask if it can be realized topologically: Is there a space $X$ such that $\pi_*X$ is isomorphic to $A$ as a $\Pi$-algebra, and if so, can we classify them?

Work of Blanc-Dwyer-Goerss provided an obstruction theory to realizing a $\Pi$-algebra $A$, where the obstructions (to existence and uniqueness) live in certain Quillen cohomology groups of $A$. What do these groups look like, and can we compute them?

We will tackle this question from the algebraic side, focusing on Quillen cohomology of truncated $\Pi$-algebras. We will then use the obstruction theory to obtain results on the classification of certain 2-stage homotopy types, and compare them to what is known from other approaches."
2010/05/03,,,,"David Gepner","UIC",,"Delooping the space of units of a commutative ring spectrum",""
2010/05/10,,,,"John Palmieri","University of Washington",,"Algebraic topology vs. Sage","The computer software package Sage (\texttt{www.sagemath.org}) understands some basic constructions from algebraic topology: it understands simplicial complexes, cubical complexes, and it seems to be the only major mathematical software package with an implementation of $\Delta$-complexes. It can perform basic operations like joins, products, and connected sums. It can compute homology and cohomology over the integers or over a field. In this talk, we will discuss and demonstrate some of these capabilities, present some related unsolved problems, and discuss future directions."
2010/09/13,,,,"Thomas Kragh","University of Oslo; MIT",,"Nearby Lagrangians ","The first part of this talk is basic definitions and 
statement of the Nearby Lagrangian Conjecture (NLC).  I will then go on 
describing previous results relating to my talk especially that of Viterbo 
in 1998 and that of Fukaya, Seidel and Smith in 2007 (refined this year by 
Abouzaid to a very strong result in the case of vanishing Maslov class).  
I will then describe an approach using fibered spectra which partly 
unifies the two rather different approaches and then state new results in 
the general case (non-vanishing Maslov class) following from a product 
structure on a fibered spectrum combined with the intersection product on 
the base manifold (probably relatable to the pair of pants product and a 
twisted version of the Chas-Sullivan product)."
2010/09/20,,,,"David Spivak","MIT",,"Categorical informatics","In this talk I will give a brief survey of what I call ``categorical 
informatics,'' which is the study of information and communication from a 
category-theoretic perspective.  In order to begin such a study, one must 
ground it in something concrete.  To that end, I'll explain a simple 
categorical model of databases, which are real-world store-houses of 
organized information.

I will then discuss information transfer between databases and move on to 
define a more general notion of communication networks.  Briefly, a 
communication network is a simplicial complex (of interacting groups) 
equipped with a sheaf of databases (common languages) on its simplices.  I 
will show how this same structure can be pared down to give a categorical 
model for combining information obtained from various sources.  I'll end 
by showing some interesting consequences of the topological nature of this 
model."
2010/09/27,,,,"Chris Schommer-Pries","MIT",,"Dualizability and Locality in 3D Topological Field Theory","In this talk I will report 
on recent work, joint with Christopher Douglas and Noah Snyder, on 
understanding the nature of fully extended (a.k.a. local) 3-dimensional 
topological quantum field theories.  Specifically, we show that fusion 
categories are fully-dualizable objects in the 3-category of tensor 
categories, a natural categorification of the bicategory of algebras, 
bimodules, and bimodule maps.  Fusion categories themselves are well-known 
are arise in several areas of mathematics and physics -- conformal field 
theory, operator algebras, representation theory of quantum groups, and 
others.  In light of Hopkins and Lurie's work on the cobordism hypothesis, 
this provides a fully local TQFT for arbitrary fusion categories.  
Moreover, we will discuss how many familiar structures from the theory of 
fusion categories are given a natural explanation from this point of 
view."
2010/10/04,,,,"Ieke Moerdijk","Utrecht",,"To what extent are Lie groupoids like Lie groups?","Lie groupoids (and Lie 
algebroids) play an increasingly important role in foliation theory, 
symplectic and Poisson geometry, and non-commutative geometry.  In this 
lecture, I will explain how some basic properties of Lie groups extend to 
groupoids, and how some other properties don't."
2010/10/18,,,,"Kyle Ormsby","MIT",,"Equivariant motivic homotopy and the completion problem for Hermitian K-theory","I will discuss the 
(motivic, or $A^1$) homotopy theory of $G$-equivariant schemes, 
$G$ a finite group.  Stabilizing with respect to regular representation of 
spheres produces a good stable theory which, in the case $G=Z/2$, 
contains motivic analogues of Atiyah's Real K-theory and Araki's Real 
cobordism over arbitrary characteristic $0$ base fields.  The algebraic 
Real $K$-theory spectrum is closely related to Hermitian $K$-theory 
(a.k.a. higher Grothendieck-Witt theory).  Tools from stable equivariant 
topology like the Tate diagram and slice spectral sequence allow us to 
resolve the completion (or homotopy limit) problem for the Hermitian 
$K$-theory of fields."
2010/11/01,,,,"Kate Ponto","Kentucky",,"Fixed points and traces","The Lefschetz fixed point theorem gives a sufficient 
condition for a continuous endomorphism to have a fixed point: If the 
Lefschetz number of a continuous endomorphism of a closed smooth manifold 
is nonzero, that endomorphism has a fixed point.  Usually no conclusions 
can be drawn if the Lefschetz number is zero, but with some (restrictive) 
hypotheses, there is a converse.  I will describe an approach to the 
converse of the Lefschetz fixed point theorem using traces that also gives 
converses to the equivariant and fiverwise Lefschetz fixed point 
theorems."
2010/11/08,,,,"Kirsten Wickelgren","Harvard",,"2 nilpotent real section conjecture","We show a 2-nilpotent section conjecture over 
$R$: for a smooth curve $X$ over $R$ with negative Euler 
characteristic, $\pi_0(X(R))$ is determined by the maximal 
2-nilpotent quotient of the fundamental group with its Galois action, as 
the kernel of an obstruction of Jordan Ellenberg.  This implies that the 
set of real points equipped with a real tangent direction of the smooth 
compactification of $X$ is determined by the maximal 2-nilpotent quotient 
of $Gal(C(X))$ with its 
$Gal(R)$ action, showing a 2-nilpotent birational 
real section conjecture."
2010/11/15,,,,"Srinikanth Iyengar","Nebraska",,"Colocalizing subcategories of the stable module category of (possibly infinite dimensional) modules over a finite group","I will describe recent work 
with Dave Benson and Henning Krause wherein we classify colocalizing 
subcategories of StMod(kG), for a finite group G, in the spirit of earlier 
work by Hopkins, Neeman, and Benson, Carlson, and Rickard on thick 
subcategories and localizing subcategories in various contexts.  A central 
result in our work is a criteria for the vanishing of a function object, 
$Hom_k(M,N)$, in StMod(kG), in terms of geometric data (to be precise: 
support and cosupport) associated to M and N, via local cohomology and 
completion functors on the stable module category."
2010/11/22,,,,"David Ayala","Harvard",,"A combinatorial $E_n$ operad","I will propose a simple and combinatorial 
$E_n$-operad which is built out of finite posets indexing a stratification 
of configuration spaces of points in an $n$-disk.  This poset is 
constructed from a category $\theta_n$ which has recently become an 
important player for modeling weak $n$-categories (Joyal, Berger, Rezk).  
The techniques involved use the formalism of quasi-categories (Lurie).  This project is joint with Richard Hepworth (Copenhagen) and is a work in progress.

One (nearly achieved) goal is to directly and geometrically relate three 
well-developed methods for recognizing $n$-fold loop spaces: as certain 
algebras over the little $n$-disk operad, as certain algebras over the 
Barratt-Eccles $E_n$ operad (via the Smith filtration), and as certain 
presheaves on $\theta_n$ (Berger).  A version of Dunn's additivity theorem 
becomes a formal consequence of the setup.  A farther away goal is to 
imitate the construction of topological chiral homology using this proposed $E_n$-operad.  This should have the benefit of making topological chiral homology (and possibly other field theories) more prepared for computations."
2010/11/29,,,,"Robin Koytcheff","Brown",,"A homotopy-theoretic view of Bott-Taubes integrals and knot spaces","Bott 
and Taubes considered a bundle over the space of knots whose fiber is a 
compactified configuration space, and they constructed knot invariants by 
performing integration along the fiber of this bundle.  Their method was 
subsequently used to construct real cohomology classes in spaces of knots 
in $R^n$, $n>3$.  Replacing integration of differential forms by a 
Pontrjagin-Thom construction, I have constructed cohomology classes with 
arbitrary coefficients.  Motivated by work of Budney and F. Cohen on the 
homology of the space of long knots in $R^3$, I have also proven a 
product formula for these classes with respect to connect-sum.  If time 
permits, I will mention some progress towards further understanding these 
classes using a cosimplicial model for knot spaces coming from the 
Goodwillie-Weiss embedding calculus."
