DATE,REASON,ALTTIME,SPECIAL,SPEAKER,INSTITUTION,WEBSITE,TITLE,ABSTRACT
2012/04/18,,,,"Bertrand Toën","Université de Montpellier 2",,"Quantization of derived moduli spaces","I will report on a work in progress in collaboration
with Pantev-Vaquié-Vezzosi. The central notion will be of a
shifted symplectic structure on a derived scheme or derived stack, which
I will explain in details. The main result is an existence statement
of shifted symplectic structures on derived mapping spaces toward a symplectic
target, that will be used to construct many examples (moduli of sheaves on
$CY$ varieties, moduli of representation of $\pi_1$ of a compact oriented
manifold, Lagrangian intersections ...). Finally, I will explain what
quantization means in this context as well the general strategy to
prove existence of canonical quantizations."
2012/04/23,,,,"Charles Rezk","University of Illinois",,"Power operations in elliptic cohomology",""
2012/04/30,,,,"Robin Koytcheff","Brown",,"A colored operad for infection of links","Budney recently constructed an operad that encodes splicing of knots and extends his little 2-cubes operad action on the space of (long) knots.  He further decomposed the space of knots as the space freely generated over the splicing operad by the subspace of torus and hyperbolic knots.  Infection of knots (or links) by string links is a generalization of splicing from knots to links and is useful for studying concordance of knots.  In joint work with John Burke, we have constructed a colored operad that encodes this infection operation.  This suggests looking for other ways to decomposes spaces of knots and links, which is a main direction of our work in progress."
2012/05/07,,,,"Marcy Robertson","UWO",,"Spaces of Operad Structures","A multicategory, also known as a colored operad, is simply a generalized non-commutative algebra. In this talk we focus on studying maps between multicategories enriched in simplicial sets. We show that the homotopy function complex of maps between any two multicategories can be computed as the moduli space of a certain small category of (operatic) bimodules. As an application, we show how this description leads to several important decompositions which allow one to compute various geometric invariants."
2012/05/14,,,,"Man Chueng Cheng","MIT",,"Duality of differentiable stacks","It was shown by Greenlees-Sadofsky that classifying spaces of finite
groups satisfy a Morava K-theory version of Poincare duality. This duality map can be viewed as coming from a Spanier-Whitehead type construction for differentiable stacks. In this talk I will define differentiable stacks and explain this construction. I will also discuss the generalization of the above result to a more general class of stacks and give some examples."
2012/09/10,,,,"Søren Galatius","Stanford",,"Homological stability for moduli spaces of high dimensional manifolds","I will discuss recent joint work with Oscar Randal-Williams concerning the manifolds $W_g^{2n}$ obtained as the connected sum of $g$ copies of $S^n \times S^n$.  For $n=1$ this is a genus $g$ surface, and there is a moduli space $M_g$ parametrizing smooth surface bundles with genus $g$ fibers.  For higher $n$ there is an analogous moduli space $M_g^n$ parametrizing smooth fiber bundles with fibers $W_g$ (although for $n > 1$ it is no longer finite dimensional).  We prove that for $n > 2$ the cohomology groups $H^k(M_g^n)$ are independent of $g$ as long as $g >> k$, generalizing a result of John Harer and others for $n=1$."
2012/09/17,,,,"Paul Arne Østvær","Oslo",,"Motivic slices and the graded Witt ring","We compute the motivic slices of hermitian $K$-theory and higher Witt-theory. The corresponding slice spectral sequences relate motivic cohomology to hermitian $K$-groups and Witt groups, respectively. Using this we compute the hermitian $K$-groups of number fields, and (re)prove Milnor's conjecture on quadratic forms for fields of characteristic different from 2. Joint work with Oliver Röndigs."
2012/09/24,,,,"Larry Guth","MIT",,"Contraction of areas and homotopy-type of mappings","I'm going to talk about connections between the geometry of a map and its homotopy type.  Suppose we have a maps from the unit $m$-sphere to the unit $n$-sphere.  We say that the $k$-dilation of the map is $< L$ if each $k$-dimensional surface with $k$-dim volume $V$ is mapped to an image with $k$-dim volume at most $LV$. Informally, if the $k$-dilation of a map is less than a small $\epsilon$, it means that the map strongly shrinks each $k$-dimensional surface. Our main question is: can a map with very small $k$-dilation still be homotopically non-trivial? Here are the main results. If $k > (m+1)/2$, then there are homotopically non-trivial maps from $S^m$ to $S^{m-1}$ with arbitrarily small $k$-dilation. But if $k \leq (m + 1)/2$, then every homotopically non-trivial map from $S^m$ to $S^{m - 1}$ has $k$-dilation at least $c(m) > 0$. "
2012/10/01,,,,"Kyle Ormsby","MIT",,"Motivic Brown-Peterson invariants of the rationals","The motivic truncated Brown-Peterson spectra BP$<$n$>$ interpolate between motivic cohomology (BP$<$0$>$), algebraic K-theory (BP$<$1$>$), and the motivic Brown-Peterson spectrum itself, a close relative of algebraic cobordism.  We use the motivic Adams spectral sequence and global-to-local comparison maps to compute the BP$<$n$>$-homology of the rational numbers.  Along the way, we prove a Hasse principle for the motivic BP$<$n$>$ and deduce several classical and recent theorems about the algebraic $K$-theory of particular fields. This is joint work with Paul Arne Østvær."
2012/10/15,,,,"Nathaniel Stapleton","MIT",,"An Application of Transchromatic Generalized Character Theory","The generalized character theory of Hopkins, Kuhn and Ravenel has proved to be a very useful tool in the study of Morava $E_n$. In this talk, I will outline a compact construction of the transchromatic generalized character maps. The Morava $E$-theory of cyclic groups and symmetric groups have well known algebro-geometric interpretations. Using the relationship between the character maps and the transfer maps for Morava $E$-theory, I will provide algebro-geometric interpretations of the cohomology of some finite groups other than symmetric groups and cyclic groups. "
2012/10/22,,,,"Vesna Stojanoska","MIT",,"A Study of tmf Cooperations","We combine three strategies to studying cooperations in 
connective topological modular forms: the Adams spectral sequence and 
its relation to Brown-Gitler modules following Mahowald's approach to 
cooperations in connective real K theory, Laures's theory of 
q-expansions of multi-variable modular forms, as well as level structure 
approximations. As a result, we obtain an algorithmic procedure for 
determining the structure of the smash product of tmf with itself. This 
is a report on joint work in progress with Behrens, Ormsby, and 
Stapleton. "
2012/10/29,,,,"Matthew Gelvin","Copenhagen",,"Parametrization of Characteristic Bisets of a Saturated Fusion System","For $G$ a finite group with Sylow subgroup $S$, the conjugation action of $G$ on the subgroups of $S$ gives rise to the data of a \emph{saturated fusion system} $\mathcal{F_S(G)}$ on $S$.  On the other hand, $S$ acts on $G$ by left and right multiplication.  The resulting $(S,S)$-biset $_SG_S$ turns out to contain much of the same information as $\mathcal{F_S(G)}$, in that the biset determines the fusion system, but not conversely. These notions can be abstracted to make no reference to the ambient group $G$, resulting in an \emph{abstract saturated fusion system} $\mathcal{F}$ on $S$ and a \emph{characteristic biset} $\Omega$ for $\mathcal{F}$.  Again, $\Omega$ determines $\mathcal{F}$, but each $\mathcal{F}$ has many associated characteristic bisets. This talk will focus on the failure of a saturated fusion system to uniquely determine a characteristic biset.  We will show that there is a parametrization of all characteristic bisets for a fixed $\mathcal{F}$, which will have as a consequence the surprising result that each saturated fusion system has a unique \emph{minimal} associated characteristic biset."
2012/11/05,,,,"Tomer Schlank","MIT",,"Obstruction Theory for Topoi and Sections for (Pro)finite Group","Given a fibration $f:X \to S$ of CW-complexes one can use Eilenberg obstruction theory to study the spaces of sections of $f$. These obstruction theory give rise to obstructions to the existence of a section lying in the groups $H^{s+1}(S, \pi_s(F))$ where $F$ is the fibre of $f$. A topos is a generalization of the concept of topological space which is ubiquitous in algebraic geometry. In the talk I shall present joint work with I. Barnea generalizing Eilenberg obstruction theory for sections of maps of topoi $f:X \to S$. If time permits I will describe applications to Galois theory of number fields."
2012/11/19,,,,"Emily Riehl","Harvard",,"The Formal Category Theory of Quasi-Categories","Quasi-categories (aka $\infty$-categories) are convenient models of categories weakly enriched in spaces. Analogs of the standard categorical theorems involving limits and colimits, adjunctions, equivalences, monads and so forth have been proven by Joyal, Lurie and others. The goal of this talk is to describe a new ground-level approach that allows for 'formal' re-proofs of these facts that requires only very mild model category prerequisites and hence generalizes. A highlight will be the construction and characterization of the quasi-category of algebras associated to a homotopy coherent monad. This is a progress report on ongoing joint work with Dominic Verity."
2012/11/26,,,,"Kirsten Wickelgren","Harvard",,"$H_1$ of the Abel-Jacobi Map to the Compactified Jacobian gives Poincaré Duality","The Picard scheme $\text{Pic}^0$ representing invertible sheaves can be compactified by a moduli space $J$-bar of rank 1, torsion-free sheaves called the compactified Jacobian. For a smooth algebraic curve $X$ over a field $k$ with boundary $\partial X$, applying $H_1$ to the Abel-Jacobi map $X \to \text{Pic}^0 (X/ \partial X)$ gives the Poincaré duality isomorphism $H_1(X,  Z/\ell) \to H^1_c(X, Z/\ell(1)) = H^1(X, \partial X, Z/\ell(1))$. We show the analogous result for the compactified Jacobian that applying $H_1$ to the Abel-Jacobi map $X/\partial X \to J$-bar gives the Poincaré duality isomorphism $H_1(X, \partial X, Z/\ell) \to H^1(X, Z/\ell(1))$. In particular, $H_1(X/ \partial X \to J$-bar$)$ is an isomorphism. This is joint work with Jesse Kass."
2012/12/03,,,,"Angélica Osorno","Chicago",,"Equivariant infinite loop space machines","An equivariant infinite loop space machine is a functor that constructs genuine equivariant spectra out of simpler categorical or space level data. In the late 80's Lewis-May-Steinberger and Shimakawa developed generalizations of the operadic approach and the $\Gamma$-space approach respectively. In this talk I will describe work in progress that aims to understand these machines conceptually, relate them to each other, and develop new machines that are more suitable for certain kinds of input. This work is joint with Anna Marie Bohmann, Peter May and Mona Merling."
2012/12/10,,,,"Steve Awodey","Carnegie Mellon",,"Homotopy Type Theory and Univalent Foundations","I will give a survey of the recently discovered connection between constructive logic and homotopy theory. This forms the basis of Voevodsky's Univalent Foundations program, a new approach to foundations with intrinsic geometric content and a computational implementation. Time permitting, I will explain the Univalence axiom."
2013/02/05,,,,"André Henriques","Utrecht",,"Progress report on the construction of TMF","Roughly ten years ago, Stephan Stolz and Peter Teichner have set up a detailed plan for constructing TMF geometrically. Unfortunately, their idea of definition is still incomplete. A couple of months ago, I had an idea (which fits into the Stolz-Teichner program) about which I am quite excited: There should be a universal CFT, which I'll call $U$. The CFT $U$ should bear with respect to other CFTs a relationship that is analogous to the relationship that an infinite dimensional Hilbert space bears with respect to other finite dimensional vector spaces. Moreover, there should exist a property of quantum fields of $U$, which I'll call `Fredholm' such that the space of Fredholm quantum fields of $U$ is a classifying space for the cohomology theory TMF. I'll explain what the theory $U$ is, and what it means for a quantum field to be `Fredholm'. Disclaimer: this is all very speculative, and I don't think that, in its current form, this will yield TMF."
2013/02/11,,,,"Michael Ching","Amherst College",,"Some examples of homotopic descent","I will describe a collection of theorems that exemplify homotopic descent. Each of these theorems says that a certain Quillen adjunction is `comonadic' in a homotopical sense: that is, it identifies the homotopy theory on one side of the adjunction with the homotopy theory of coalgebras over a certain comonad that acts on the other side. I will say what I mean by the homotopy theory of such coalgebras and give a Barr-Beck comonadicity condition.

The examples concern operad theory and Goodwillie calculus. One result identifies the homotopy theory of 0-connected algebras over an operad of spectra with that of 0-connected divided power coalgebras over the Koszul dual operad. (This is joint work with John Harper.) Another describes the homotopy theory of n-excisive homotopy functors (between categories of spaces and/or spectra) in terms of appropriate comonads. (This is joint work with Greg Arone.) In the case of functors from spaces to spectra, and algebras over the commutative operad, there is a close connection between these two examples, which I shall describe."
2013/02/25,,,,"Matthew Gelvin","University of Copenhagen",,"Parametrization of characteristic bisets of a saturated fusion system","For $G$ a finite group with Sylow subgroup $S$, the conjugation action of $G$ on the subgroups of $S$ gives rise to the data of a \emph{saturated fusion system} $\mathcal{F_S(G)}$ on $S$.  On the other hand, $S$ acts on $G$ by left and right multiplication.  The resulting $(S,S)$-biset $_SG_S$ turns out to contain much of the same information as $\mathcal{F_S(G)}$, in that the biset determines the fusion system, but not conversely.

These notions can be abstracted to make no reference to the ambient group $G$, resulting in an \emph{abstract saturated fusion system} $\mathcal{F}$ on $S$ and a \emph{characteristic biset} $\Omega$ for $\mathcal{F}$.  Again, $\Omega$ determines $\mathcal{F}$, but each $\mathcal{F}$ has many associated characteristic bisets.  

This talk will focus on the failure of a saturated fusion system to uniquely determine a characteristic biset.  We will show that there is a parametrization of all characteristic bisets for a fixed $\mathcal{F}$, which will have as a consequence the surprising result that each saturated fusion system has a unique \emph{minimal} associated characteristic biset."
2013/03/04,,,,"Ethan Devinatz","University of Washington",,"Higher homotopy commutativity of small ring spectra","Given a finite spectrum of type $n$, explicit $v_n$ self-maps are 
more easily constructed if that spectrum is a ring spectrum, by which I
mean the spectrum is provided with a pairing which has a two-sided unit 
but is not necessarily homotopy commutative or homotopy associative. 
If in addition, the spectrum is homotopy associative and homotopy 
commutative, one can sometimes say more.

Twenty five years ago I proved that if $X$ is a finite ring spectrum of 
type n, then there exists a $v_n$ self-map f such that the cofiber $X(f^i)$ of 
the self-map $f^i$ is a ring spectrum for any $i$, and the pairing on $X(f^i)$
extends the pairing on $X$.  In this talk, I will discuss my recent result 
that if $X$ is higher homotopy commutative up to some finite order, then $f$
may be chosen so that this higher homotopy commutative structure may be 
extended to such a structure on $X(f^i)$."
2013/03/11,,,,"Dustin Clausen","MIT",,"Arithmetic duality in algebraic K-theory","We will discuss an analog in algebraic K-theory of the
Poitou-Tate global duality in Galois cohomology.  A key point is that the
use of algebraic K-theory instead of Galois cohomology allows to give a
direct and pictorial construction of the fundamental class which is at
the base of these dualities.  It also allows to connect this arithmetic
theory with some classical and modern work in homotopy theory, such as
Quillen's on the J-homomorphism and Rezk's on logarithmic cohomology
operations."
2013/03/18,,,,"Nitu Kitchloo","Johns Hopkins University",,"The Stable Symplectic category and the Grothendieck-Teichmuller group","The Stable Symplectic category can the thought of as a category of Symplectic Motives. The objects in this topological category are symplectic manifolds, and the space of morphisms is an infinite loop space obtained by stabilizing the space of immersed totally-real correspondences between the source and target. A variant of this category can be traced back almost 30 years to early work of A. Weinstein on geometric quantization. In my talk, I will motivate the definition of the Stable Symplectic category. This will lead us to the construction of a canonical fiber functor F, on this category with values in the monoidal category of modules over a commutative ring spectrum Omega. The main aim of my talk is to explore the Motivic Galois group Aut(F) (i.e. the group of monoidal automorphisms of F). This group will be shown to be the abelian quotient of the Grothendieck-Teichmuller group as described by Kontsevich. Extending this observation along the lines of homotopy theory, we will motivate the topological hochschild homology of Omega:THH(Omega), as an integral candidate for Aut(F). If time permits, I would like to formulate some natural geometric questions in symplectic topology in terms of THH(Omega) and the Waldhausen K-theory K(Omega). This is joint work in part with Jack Morava."
2013/04/01,,,,"Jack Ullman","MIT",,"The regular slice spectral sequence","The equivariant slice spectral sequence was introduced by Hill, Hopkins
and Ravenel in their solution of the Kervaire invariant problem, and is
rapidly becoming an important computational tool in equivariant stable
homotopy theory. In this talk, I will describe new results on a variant
called the regular slice spectral sequence (or RSSS). I will explain how
geometric fixed point and norm functors interact with the slice filtration,
giving a Leibniz formula for the latter. I will then use Brown-Comenetz
duality to relate the RSSS to the homotopy orbit and homotopy fixed point
spectral sequences. Next, I will use model theory to obtain Toda bracket
operations in the RSSS. Finally, I will use some of these tools to obtain a
formula for the slice tower of a cofree spectrum, prove real Bott
periodicity and prove a special case of the Atiyah-Segal completion
theorem."
2013/04/08,,,,"John Lind","Johns Hopkins University",,"Equivariantly Twisted Cohomology Theories","Twisted K-theory is a cohomology theory whose cocycles are like vector
bundles but with locally twisted transition functions.  If we instead
consider twisted vector bundles with a symmetry encoded by the action
of a compact Lie group, the resulting theory is equivariant twisted
K-theory.  This subject has garnered much attention for its
connections to conformal field theory and representations of loop
groups.  While twisted K-theory can be defined entirely in terms of
the geometry of vector bundles, there is a homotopy-theoretic
formulation using the language of parametrized spectra.  In fact, from
this point of view we can define twists of any multiplicative
generalized cohomology theory, not just K-theory.  The aim of this
talk is to explain how this works, and then to propose a definition of
equivariant twisted cohomology theories using a similar framework.
The main ingredient is a structured approach to multiplicative
homotopy theory that allows for the notion of a G-torsor where G is a
grouplike A_{\infty} space."
2013/04/22,,,,"Geoffroy Horel","MIT",,"Operads, Modules and higher Hochschild cohomology","In this talk I will describe a general theory of modules over an algebra over an operad. Specializing to the operad Ed of little d-dimensional disks, I will show that each d-1 manifold gives rise to a theory of modules. I will then describe a geometric construction of the homomorphisms objects in these categories of modules inspired by factorization homology (also called chiral homology). A particular case of this construction is higher Hochschild cohomology (i.e. Hochschild cohomology for Ed-algebras). This construction enlightens the relationship between Hocshchild cohomology and geometric objects like the cobordism category and the spaces of long knots."
2013/04/29,,,,"Luis Pereira","MIT",,"Goodwillie Calculus and Algebras over a Spectral Operad","The overall goal of this talk is to apply the theory of Goodwillie calculus to the
category $Alg_{\mathcal{O}}$ of algebras over a spectral operad.
Its first part will deal with generalizing many of the original results of Goodwillie so that
they apply to a larger class of model categories and hence be applicable to $Alg_{\mathcal{O}}$.
The second part will apply that generalized theory to the $Alg_{\mathcal{O}}$ categories. The
main results here are: an understanding of finitary homogeneous functors between such categories;
identifying the Taylor tower of the identity in those categories; showing that
finitary n-excisive functors can not distinguish between $Alg_{\mathcal{O}}$ and $Alg_{\mathcal{O_{\leq n}}}$, the category
of algebras over the truncated $O_{\leq n}$; and a weak form of the chain rule
between such algebra categories, analogous to the one studied by Arone and Ching in the case of Spaces and Spectra."
2013/04/30,,,,"Rune Haugseng","MIT",,"Weakly Enriched Higher Categories","Categories enriched in symmetric monoidal categories such as spectra turn
up in various places in algebraic topology. Unfortunately these can be
difficult to work with in a homotopically meaningful way, which suggests
that for many purposes it would be better to work with less rigid
structures, where composition is only associative up to coherent homotopy.
In this talk I will introduce a general theory of such weak or
homotopy-coherent enrichment, built using a non-symmetric variant of
Lurie's infinity-operads. I will then describe how the correct homotopy
theory of these enriched infinity-categories can be constructed as a
localization of a homotopy theory defined using infinity-operads; this is
joint work with David Gepner. In addition, I will discuss some comparison
results and, time permitting, mention analogues of natural transformations
and correspondences in this setting."
2013/05/13,,,,"Marco Varisco","SUNY",,"Algebraic K-Theory of Group Rings and Topological Cyclic Homology","The Farrell-Jones Conjecture predicts the structure of the algebraic K-theory K(ZG) of the integral group ring of an arbitrary discrete group G. It asserts that a so-called assembly map (whose target is the spectrum K(ZG) and whose source is the homotopy colimit of K(ZH) over all virtually cyclic subgroups H of G) is an equivalence.
I will describe joint work with Wolfgang Lück, Holger Reich, and John Rognes, in which we prove partial injectivity results about the rationalized assembly map under finiteness assumptions on the group G, generalizing a theorem of Bökstedt-Hsiang-Madsen. The main tool is the cyclotomic trace map from algebraic K-theory to topological cyclic homology."
2013/09/09,,,,"Anna Marie Bohmann","Northwestern University",,"An equivariant infinite loop space machine","An equivariant infinite loop space machine should turn categorical or algebraic data into genuine spectra. While infinite loop space machines have been a crucial part of homotopy theory for decades, equivariant versions are in early stages of development. 

I will describe joint work with A. Osorno in which we build an equivariant infinite loop space machine that starts with diagrams of categories on the Burnside category and produces a genuine G-spectrum via the work of Guillou-May. This
machine readily applies to produce Eilenberg-MacLane spectra for Mackey functors and topological K-theory."
2013/09/16,,,,"S\o ren Galatius","Stanford University",,"Homological stability for moduli spaces of manifolds","For an inclusion $S \subset S'$ of connected orientable surfaces, J. Harer proved in 1985 that the map $H_k(BDiff(S)) \rightarrow H_k(BDiff(S'))$, induced by extending orientation preserving diffeomorphisms of $S$ by the identity map of $S'-S$, is an isomorphism when $k$ is small compared to the genus of $S$.  I will discuss a generalization of this statement to higher-dimensional manifolds.  As a consequence, we prove that if $M$ is a closed smooth simply connected manifold of dimension $2n > 4$, such that $M$ is diffeomorphic to the connected sum of $g$ copies of $S^n \times S^n$ and some other manifold, then the cohomology of $BDiff(M)$ in the range $* \leq (g-4)/2$ is described in terms of a single characteristic class in a twisted cobordism group.  This is joint work with O. Randal-Williams."
