DATE,REASON,ALTTIME,SPECIAL,SPEAKER,INSTITUTION,WEBSITE,TITLE,ABSTRACT
2014/12/15,,,,"Andrew Ranicki","University of Edinburgh",,"The total surgery obstruction","The total surgery obtruction invariant was introduced 35 years ago to unify the two stages of the 
classical Browder-Novikov-Sullivan-Wall surgery theory of topological manifold types in the homotopy type 
of an n-dimensional global Poincare duality space X, with n>4. The space X has local Poincare duality 
if and only if it is a homology manifold. In effect, a topological manifold in the homotopy type of X is the same as a 
globally contractible quadratic Poincare null-cobordism of the chain level failure of local Poincare duality. (The talk will explain 
the terms involved). The invariant is the obstruction to the existence of such a null-cobordism. The talk will review progress 
in total surgery obstruction theory, which is best understood  in terms of a combinatorial analogue of the Verdier duality in sheaf theory."
2015/02/09,,,,"Emily Riehl","Harvard",,"The formal category theory of ($\infty$,n)-categories","Pioneering work of Andre Joyal and Jacob Lurie has shown that ordinary category theory can be extended to quasi-categories (``$\infty$-categories''), a type of ($\infty$,1)-category. In joint work with Verity, we show that the category theory of quasi-categories is 2-categorical: new definitions of the basic notions - (co)limits, adjunctions, fibrations - equivalent to the Joyal-Lurie definitions, can be encoded in the homotopy 2-category of quasi-categories. Our 2-categorical proofs in the homotopy 2-category restrict to  the classical ones in the sub 2-category CAT. We give a short list of axioms, satisfied by (iterated) complete Segal spaces, that suffice for this homotopy 2-categorical development, so this ``formal'' approach to the category theory of quasi-categories immediately extends to other models of higher homotopical categories."
2015/02/13,,,,"Nathaniel Stapleton","Bonn",,"The character of the total power operation","We construct a total power operation on n-fold class functions compatible with the total power operation in Morava E-theory through the character map of Hopkins, Kuhn, and Ravenel. In essence, this gives a formula for the total power operation in Morava E-theory applied to a finite group. This is joint work with Barthel."
2015/02/17,,,,"John Harper","Ohio State",,"Derived Koszul duality and TQ-homology completion","Consider a flavor of structured ring spectra that can be described as algebras over an operad $O$ in spectra. A natural question to ask is when the fundamental adjunction comparing $O$-algebra spectra with coalgebra spectra over the associated Koszul dual comonad $K$ can be modified to turn it into an equivalence of homotopy theories. In a paper published in 2012, Francis and Gaitsgory conjecture that replacing $O$-algebras with the full subcategory of homotopy pro-nilpotent $O$-algebras will do the trick. In joint work with Kathryn Hess we show that every 0-connected $O$-algebra is homotopy pro-nilpotent; i.e. is the homotopy limit of a tower of nilpotent $O$-algebras.

This talk will describe recent work, joint with Michael Ching, that resolves in the affirmative the 0-connected case of the Francis-Gaitsgory conjecture; that replacing $O$-algebras with 0-connected $O$-algebras turns the fundamental adjunction into an equivalence of homotopy theories. This can be thought of as a spectral algebra analog of the fundamental work of Quillen and Sullivan on the
rational homotopy theory of spaces, the subsequent work of Goerss and Mandell on the p-adic homotopy theory of spaces, and the work of
Mandell on integral cochains and homotopy type. Corollaries include the following: (i) 0-connected $O$-algebra spectra are weakly equivalent
if and only if their $TQ$-homology spectra are weakly equivalent as derived $K$-coalgebras, and (ii) if a $K$-coalgebra spectrum is 0-connected and cofibrant, then it comes from the $TQ$-homology spectrum of an $O$-algebra."
2015/02/23,,,,"Mike Hill","UVa",,"Flavors of equivariant commutativity","Classically, there is essentially only one $E_\infty$ operad, and it parameterizes multiplications commutative up to all higher homotopies. In the $G$-equivariant context, the situation is muddied by the possible ways the group can interact with the powers of a space or spectrum. In this talk, I'll discuss the notion of an $N_\infty$ operad, an operad in $G$-space which just like the $E_\infty$ operad parameterizes multiplications commutative up to all higher homotopies but which also allows $G$ to permute factors. The use of these allows one to understand operadically the transfer map on equivariant infinite loop spaces, to see what structure is preserved by equivariant Bousfield localization, and to tease apart what sort of additional structure the category of modules over an equivariant commutative ring spectrum has."
2015/03/02,,,,"Nicolo Sibilla","UBC",,"The topological Fukaya category and mirror symmetry for toric Calabi-Yau threefolds","The Fukaya category of open symplectic manifolds is expected to have good local-to-global properties. Based on this idea several people have developed sheaf-theoretic models for the Fukaya category of punctured Riemann surfaces: the name topological Fukaya category appearing in the title refers to the (equivalent) constructions due to Dyckerhoff-Kapranov, Nadler and Sibilla-Treumann-Zaslow. The theory involved in setting up the topological Fukaya category has surprising connections with many different areas of geometry and topology, such as for instance the co-representability of the Waldhausen S-construction. In this talk I will focus on defining the topological Fukaya category and explain applications to Homological Mirror Symmetry for toric Calabi-Yau threefolds. This is work in progress joint with James Pascaleff."
2015/03/09,,,,"Ryan Grady","BU",,"Derived geometry as a tool for QFT, QFT as a tool in topology","In this talk I will highlight how formal moduli problems and derived stacks have a role in constructing quantum field theories. I will then focus on a specific example which allows one to give a new proof of the algebraic index theorem of Nest-Tsygan and Fedosov.  If time permits, I will also discuss observables in QFT and their structure as a factorization algebra; giving a further reinterpretation of the algebraic index theorem and some insight into higher analogues of index theory."
2015/03/16,,,,"Emily Riehl","Harvard",,"The formal category theory of ($\infty$,n)-categories","Pioneering work of Andre Joyal and Jacob Lurie has shown that ordinary category theory can be extended to quasi-categories (``$\infty$-categories''), a type of ($\infty$,1)-category. In joint work with Verity, we show that the category theory of quasi-categories is 2-categorical: new definitions of the basic notions - (co)limits, adjunctions, fibrations - equivalent to the Joyal-Lurie definitions, can be encoded in the homotopy 2-category of quasi-categories. Our 2-categorical proofs in the homotopy 2-category restrict to  the classical ones in the sub 2-category CAT. We give a short list of axioms, satisfied by (iterated) complete Segal spaces, that suffice for this homotopy 2-categorical development, so this ``formal'' approach to the category theory of quasi-categories immediately extends to other models of higher homotopical categories."
2015/03/30,,,,"David Gepner","Purdue",,"Localization sequences in the algebraic $K$-theory of ring spectra","Together with trace methods, the localization sequence comprises one of the only known methods for computing algebraic $K$-theory. If $R$ is a ring spectrum and $R[S^{-1}]$ is a localization of R, then there is a fiber sequence of $K$-theory spectra $K(\text{fiber}) \to K(R) \to K(R[S^{-1}])$. In this talk, we will show that (under mild conditions) the fiber term is compactly generated by a Koszul-type spectrum formed from $R$ and $S$, which when $R= BP \langle n \rangle$ and $S = \{v_n \}$ differs from $BP \langle n-1 \rangle = R/v_n$. We will then apply trace methods to show that their $K$-theories differ, answering a question of Rognes. Time permitting, we will sketch how this fits into a general program (primarily due to Waldhausen, Rognes, Ausoni, and others) to understand the $K$-theory of the sphere in terms of the chromatic filtration of the stable homotopy category. This is joint work with Benjamin Antieau and Tobias Barthel."
2015/04/06,,,,"Mike Shulman","University of San Diego",,"Internal languages for $\infty$-toposes and sub-$\infty$-toposes","One of the most important insights of classical topos theory is that a topos (a category of sheaves) has an `internal language', so that we can reason about its objects roughly `as if they were sets'. The recent development of `homotopy type theory' provides a similar internal language for $\infty$-toposes ($\infty$-categories of stacks), allowing us to reason about its objects `as if they were spaces'. I will sketch this language and show how to apply it to study sub-$\infty$-toposes; these are represented internally as `higher modalities' on a Martin-Löf-Voevodsky universe, generalizing Lawvere-Tierney operators from classical topos theory."
2015/04/13,,,,"Michael Andrews","MIT",,"The $v_1$-periodic part of the Adams spectral sequence at an odd prime - dancers to a discordant system","Algebraic topologists are interested in the class of spaces which can be built from spheres. For this reason, when one tries to understand the continuous maps between two spaces up to homotopy, it is natural to restrict attention to the maps between spheres first. The groups of interest are called the homotopy groups of spheres. Topologists soon realized that it is easier to work in a stable setting. Instead, one asks about the stable homotopy groups of spheres or, equivalently, the homotopy groups of the sphere spectrum. Calculating all of these groups is an impossible task but one can ask for partial information.

In particular, one can try to understand the global structure of these groups by proving the existence of recurring patterns; this is analogous to the fact that we cannot find all the prime numbers, but we can prove theorems about their distribution. These patterns are clearly visible in spectral sequence charts for calculating $\pi_*(S^0)$ and my thesis came about because of my desire to understand the mystery behind these powerful dots and lines, which others in the field appeared so in awe of. I will tell the story of the stable homotopy groups of spheres for odd primes at chromatic height 1, through the lens of the Adams spectral sequence."
2015/04/14,,,,"Guozhen Wang","MIT",,"Unstable Chromatic Homotopy Theory","
Using the self maps provided by the Hopkins-Smith periodicity theorem, we can decompose the unstable homotopy groups of a space into its periodic parts, except some lower stems. For fixed n, using the Bousfield-Kuhn functor we can associate to any space a spectrum, which captures the $v_n$-periodic part of its homotopy groups.

I will talk about the homotopy type of the Bousfield-Kuhn functor applied to spheres, which would tell us much about the $v_n$-periodic part of the homotopy groups of spheres provided we have a good understanding of the telescope conjecture. I will make use of the Goodwillie tower of the identity functor, which resolves the unstable spheres into spectra which are the Steinberg summands of the classifying spaces of the additive groups of vector spaces over finite fields.

By understanding the attaching maps of the Goodwillie tower after applying the Bousfield-Kuhn functor, we would be able to determine the homotopy type of its effect on spheres. As an example of how this works in concrete computations, I will compute the K(2)-local homotopy groups of the three sphere at primes p>3.

The computations show that the unstable homotopy groups not only have finite p-torsion, their K(2)-local parts also have finite $v_1$-torsion, which indicates there might be a more general finite $v_n$-torsion phenomena in the unstable world, conjectured by many people."
2015/04/27,,,,"Paul Goerss","Northwestern",,"Resolutions and duality in $K(2)$-local homotopy theory","The chromatic view of stable homotopy theory assembles a finite spectrum from its $K(n)$-localizations, focusing our attention on the $K(n)$-local category. This category has a number of interrelated dualities, which together go under the name of Gross-Hopkins duality. I'd like to explore this in the case $n=2$ using the topological resolutions developed with Henn, Mahowald, Rezk, and others. In particular, I'd like to explain how there is an elegant inevitability to calculations long regarded as impenetrable."
2015/05/04,,,,"Agnes Beaudry","Chicago",,"The Chromatic Splitting Conjecture at $n=p=2$","In its strongest form, the chromatic splitting conjecture gives a precise description of the homotopy type of $L_{1}L_{K(2)}S$, which has been shown to hold for $p\geq 5$ by Hopkins and for $p=3$ by Goerss, Henn and Mahowald. In this talk, I will explain why this description cannot hold at the prime $p=2$. More precisely, let $V(0)$ be the mod $2$ Moore spectrum. I will give a summary of how one uses the duality resolution techniques to show that $\pi_{k}L_1L_{K(2)}V(0)$ is not zero when $k$ is congruent to $5$ modulo $8$. I will explain how this contradicts the decomposition of $L_1L_{K(2)}S$ predicted by the chromatic splitting conjecture."
2015/05/11,,,,"Emanuele Dotto","MIT",,"Equivariant calculus of functors","
Let $G$ be a finite group. There is a notion of ``$J$-excision'' of functors on pointed $G$-spaces, for every finite $G$-set $J$. When $J$ is the trivial $G$-set with $n$ elements it agrees with Goodwillie's definition of $n$-excision. When $J=G$ it recovers Blumberg's notion of equivariant excision.

The talk will focus on the $J$-excisive approximations of a homotopy functor, and how they fit together into a ``Taylor tree''. We will discuss the convergence of the tree, as well as possible classifications of $J$-homogeneous functors. Finally, we will relate the layers of the ``genuine'' tower of the identity functor on pointed $G$-spaces to partition complexes, and discuss possible applications of $\mathbb{Z}/2$-calculus to Real algebraic $K$-theory."
2009/12/07,,,,"Clark Barwick","Harvard University",http://www.math.harvard.edu/~clarkbar/,"Equivariant derived algebraic geometry and K-theory",
2009/11/30,,,,"Barry Walker","Northwestern University",http://www.math.northwestern.edu/~bjwalker/,"Orientations and $p$-adic analysis","Ando constructed power operations for the Lubin-Tate cohomology theories using the theory of finite subgroups of a formal group. Moreover, he was able to produce a necessary and sufficient condition for a complex orientation of these cohomology theories to be compatible with the power operations. This result concerns the stable homotopy category of spectra. However, the Lubin-Tate spectra of Morava are very rigid objects. Using ideas of Ando, Hopkins and Rezk, we can classify those orientations of complex K-Theory that are compatible with Ando's power operations, but on the point set level. In this talk, we will show the equivalence of these two descriptions for complex p-adic K-Theory. To achieve this goal, we use the language of Bernoulli numbers attached to a formal group law and their relationship with distributions on a $p$-adic Lie group. Many of these tools were developed by N. Katz and J. Tate."
2009/11/24,,,"This will be a Tuesday talk, at 4pm in 2-132.","Charles Rezk",UIUC,http://www.math.uiuc.edu/~rezk/,"Koszul resolutions for algebras of power operations","Morava E-theory (the complex oriented cohomology theories associated to deformations of formal groups) are structured commutative ring spectra, and so support a well-behaved theory of power operations. We describe what is know about this theory, and we prove a conjecture of Ando, Hopkins, and Strickland, that the ring of power operations for such theories is Koszul."
2009/11/23,,,,"Rekha Santhanam","Johns Hopkins University",http://www.math.jhu.edu/~santhana/,"Equivariant $\Gamma$-spaces","Costenoble and Waner showed that grouplike equivariant $E_\infty$- spaces model equivariant infinite loop spaces. Shimakawa gave an equivariant analog of $\Gamma$-spaces to model equivariant infinite loop spaces. We describe equivariant $\Gamma$ spaces as defined by Shimakawa. We show that the categories of equivariant $E_\infty$-spaces and equivariant $\Gamma$-spaces are Quillen equivalent with appropriate model categories. Following Segal's work, we give a construction of equivariant $\Gamma$- spaces (and hence of equivariant infinite loop spaces) from symmetric monoidal $G$-categories for finite group $G$."
2009/11/16,,,,"Martin Bendersky",CUNY,http://math.hunter.cuny.edu/mbenders/,"The unstable chromatic spectral sequence","The (stable) chromatic spectral sequence has had a significant impact on our understanding of the stable homotopy groups of the spheres. I will talk about preliminary attempts to construct an unstable version. I will try to describe a filtration of the stable chromatic spectral sequence induced by the Hopf rings for the odd spheres. There are natural questions that arise in the unstable world (e.g. an unstable version of the Morava stabilizer algebra) and a chromatic interpretation of the Hopf invariant."
2009/11/09,,,,"Tyler Lawson","University of Minnesota",http://www.math.umn.edu/~tlawson/,"$p$-divisible groups, automorphic forms, and displays","Lurie's theorem allows the functorial construction of $E_\infty$ ring spectra associated to certain $p$-divisible groups. In this talk I will discuss three situations in which we can apply this and attempts to understand the computational results. The first is joint work with Behrens on the relationship between the moduli of elliptic curves and certain moduli of abelian surfaces with complex multiplication. The second is joint work with Hill on Shimura curves that parametrize ""false elliptic curves"", and in particular trying to obtain computations of the homotopy of the associated spectra without niceties such as $q$-expansions and Weierstrass equations. The third is on using Zink's work on displays to produce $E_\infty$ ring spectra from purely algebraic input data, in the form of invertible matrices over Witt rings."
2009/11/02,,,,"Hans-Werner Henn","University of Strasbourg",http://www-irma.u-strasbg.fr/~henn/,"The rationalization of the $K(2)$-local sphere and Picard groups at chromatic level $2$ for $p=3$.",
2009/10/26,,,,"Kirsten Wickelgren","Harvard University",http://math.harvard.edu/~kirsten/,"Étale $\pi_1$ obstructions to homotopy sections of curves","Grothendieck's anabelian conjectures say that hyperbolic algebraic curves over number fields should be $K(\pi,1)$'s in algebraic geometry. It follows that conjecturally the rational points on such a curve are the sections of étale $\pi_1$ of the structure map. These conjectures are analogous to equivalences between fixed points and homotopy fixed points of Galois actions on related topological spaces. We use cohomological obstructions of Jordan Ellenberg coming from nilpotent approximations to the curve to study the sections of étale $\pi_1$ of the structure map. We will relate Ellenberg's obstructions to Massey products, and explicitly compute mod $2$ versions of the first and second for $P^1-\{0,1,\infty\}$ over $\mathbf{Q}$. Over $\mathbf{R}$, we show the first obstruction alone determines the connected components of real points of the curve from those of the Jacobian."
2009/10/19,,,,"Emmanuel Farjoun","Hebrew University",http://www.ma.huji.ac.il/~farjoun/,"Homotopy normality and homotopy ideals.",
2009/10/05,,,,"Gereon Quick","WWU Muenster",http://wwwmath.uni-muenster.de/u/gquick/,"Some applications of profinite homotopy theory","The playing field of profinite homotopy theory is provided by the homotopy categories of profinite spaces and profinite spectra. A motivating application is the connection to algebraic geometry. For example the etale fundamental group and continuous etale cohomology of a scheme can be defined in a unified way using a profinite etale realization functor. We will discuss this functor and use it to define etale topological cobordism. But it turned out that profinite structures might be useful in other areas such as Lubin-Tate spectra. If time permits we will discuss this idea in progress as well."
2009/09/29,,,"This will be a Tuesday talk, at 4pm in 2-132.","Søren Galatius","Stanford University",http://math.stanford.edu/~galatius/,"Monoids of moduli spaces of manifolds.",
2009/09/28,,,,"Mike Hill","Harvard University",http://people.virginia.edu/~mah7cd/,"Equivariant computations and $\mathrm{RO}(G)$-graded spectral sequences.",
2009/09/21,,,,"David Ayala","University of Copenhagen",http://math.stanford.edu/~ayala/,"Singular field theories","This talk will motivate and develop a bordism category consisting of singular manifolds. Applications will be discussed having relevance to 'stable' characteristic classes of families of smooth manifolds and Gromov-Witten theory."
2009/09/14,,,,"Chris Schommer-Pries","Harvard University",http://sites.google.com/site/chrisschommerpriesmath/Home,"Extensions of $2$-Groups and a Finite Dimensional Model of the String Group","The $6$-connected cover of $\mathrm{Spin}(n)$, known as the group $\mathrm{String}(n)$, has fascinating connections with both abstract homotopy theory (through String Bordism and TMF) and with quantum field theory (through the 2D SUSY non-linear sigma model). A better geometric understanding of String geometry has the potential to offer new interactions between these fields. Unfortunately all previous models of $\mathrm{String}(n)$ are infinite dimensional, making a thorough geometric understanding elusive. In this talk we will construct a finite dimensional model of $\mathrm{String}(n)$ as a higher categorical version of a group (known as a $2$-group). In the process, we will ""categorify"" the classical notions of group cohomology and derived functor. In particular we will categorify Segal's topological group cohomology, thereby obtaining a classification of extensions of topological $2$-groups."
2009/05/18,,,"This talk will take place at the normal time (4:30) in 4-270.","Mike Hopkins","Harvard University",http://math.harvard.edu/people/HopkinsMichael.html,"The Kervaire Invariant",
2009/05/12,,,"This will be a Tuesday talk, at 4:00 in 2-151","José Gómez","University of British Columbia",http://www.math.ubc.ca/~josmago/,"Stable splittings and almost commuting elements","In this talk we will show that the space of almost commuting elements in a compact Lie group splits after one suspension."
2009/05/11,,,,"Christian Ausoni","University of Bonn",,"Algebraic K-Theory of K-theory spectra.",
2009/05/04,,,,"David Spivak","University of Oregon",http://www.uoregon.edu/~dspivak/,"Derived smooth manifolds","Given a smooth manifold $M$ and two submanifolds $A$ and $B$, their intersection need not be a smooth manifold. By Thom's transversality theorem, one can deform $A$ to be transverse to $B$ and take the intersection: the result, written $A\cap B$, will be a smooth manifold. Moreover, if $A$ and $B$ are compact, then there is a cup product formula in cobordism, integral cohomology, etc. of the form $[A]\cup[B]=[AB]$, where $[\cdot]$ denotes the cohomology fundamental class.  The problem is that $AB$ is not unique, and there is no functorial way to choose transverse intersections for pairs of submanifolds. The goal of the theory of derived manifolds is to correct this defect.  The category of derived manifolds contains the category of manifolds as a full subcategory, is closed under taking intersections of manifolds, and yet has enough structure that every compact derived manifold has a fundamental class. Even if the submanifolds $A$ and $B$ of $M$ are not transverse (in which case their intersection can be arbitrarily singular), their intersection $A\times_MB$ will be a derived manifold with $[A\times_MB]= [AB]$, and thus satisfy the above cup product formula.  To construct the category of derived manifolds, one imitates the constructions of schemes, but in a smooth and homotopical way. I will begin the talk by explaining this construction. Then I will give some examples and discuss some features of the category of derived manifolds. I will end by sketching the Thom-Pontrjagin argument which implies that compact derived manifolds have fundamental classes."
2009/04/27,,,,"Stefan Hornet","Harvard University",,"A generalization of a theorem of Ravenel and Wilson.",
2009/04/15,,,"This will be a Wednesday talk, at 4:00 in 2-143.","Fred Cohen","University of Rochester",http://www.math.rochester.edu/people/faculty/cohf/,"Generalized moment-angle complexes","A second subspace of a product is the generalized moment-angle complex first defined in generality by Neil Strickland. Definitions, examples, as well as connections will be addressed.

One notable case is given by subspaces of products of infinite dimensional complex projective space 'indexed by a finite simplicial complex'. These spaces appearing in work of Goresky-MacPherson, Davis-Januskiewicz, Buchstaber-Panov-Ray, Denham-Suciu, Franz as well as many others encode information ranging from the structure of toric varieties in one guise, Stanley-Reisner rings, as well as 'motions of certain types of robotic legs' in another guise.

What do these spaces have to do with the motions of legs of a cockroach? This feature will be illustrated with slides.

Features of these spaces are developed within the context of classical homotopy theory based on joint work with A. Bahri, M. Bendersky, and S. Gitler."
